{
  "$schema": "https://json-schema.org/draft/2020-12/schema",
  "$id": "https://github.com/den-run-ai/chessy/eval/e4/exploration-manifest.schema.json",
  "title": "Chessy E4-v1 exploration manifest",
  "type": "object",
  "additionalProperties": false,
  "required": [
    "$schema",
    "schema",
    "manifestId",
    "protocolId",
    "kind",
    "status",
    "protocol",
    "adapter",
    "productBaseline",
    "source",
    "anchorRuntime",
    "schedulePolicy",
    "schedules",
    "openingClusters",
    "assignments",
    "freeze"
  ],
  "properties": {
    "$schema": {
      "const": "./exploration-manifest.schema.json"
    },
    "schema": {
      "const": "chessy.e4.exploration-manifest.v1"
    },
    "manifestId": {
      "type": "string",
      "minLength": 1
    },
    "protocolId": {
      "const": "E4-v1"
    },
    "kind": {
      "const": "exploration"
    },
    "status": {
      "enum": [
        "awaiting-opening-freeze",
        "frozen"
      ]
    },
    "protocol": {
      "$ref": "#/$defs/filePin"
    },
    "adapter": {
      "$ref": "#/$defs/filePin"
    },
    "productBaseline": {
      "$ref": "#/$defs/productBaseline"
    },
    "source": {
      "$ref": "#/$defs/source"
    },
    "anchorRuntime": {
      "$ref": "#/$defs/anchorRuntime"
    },
    "schedulePolicy": {
      "type": "object",
      "additionalProperties": false,
      "required": [
        "countSpecifiedByProtocol",
        "countMustBeFrozenBeforeRun",
        "colorsPerOpening",
        "anchorSelection",
        "manifestSeedUse",
        "engineSeedOverride"
      ],
      "properties": {
        "countSpecifiedByProtocol": {
          "const": false
        },
        "countMustBeFrozenBeforeRun": {
          "const": true
        },
        "colorsPerOpening": {
          "const": 2
        },
        "anchorSelection": {
          "const": "nearest-only"
        },
        "manifestSeedUse": {
          "const": "schedule-result-bootstrap-only"
        },
        "engineSeedOverride": {
          "const": false
        }
      }
    },
    "schedules": {
      "type": "array",
      "minItems": 5,
      "maxItems": 5,
      "items": {
        "$ref": "#/$defs/explorationSchedule"
      }
    },
    "openingClusters": {
      "type": "array",
      "items": {
        "$ref": "#/$defs/openingCluster"
      }
    },
    "assignments": {
      "type": "array",
      "items": {
        "$ref": "#/$defs/explorationAssignment"
      }
    },
    "freeze": {
      "$ref": "#/$defs/freeze"
    }
  },
  "allOf": [
    {
      "if": {
        "properties": {
          "status": {
            "const": "awaiting-opening-freeze"
          }
        }
      },
      "then": {
        "properties": {
          "openingClusters": {
            "maxItems": 0
          },
          "assignments": {
            "maxItems": 0
          },
          "freeze": {
            "properties": {
              "immutable": {
                "const": false
              },
              "freezeBaseCommit": {
                "type": "null"
              },
              "contentSha256": {
                "type": "null"
              },
              "openingSetSha256": {
                "type": "null"
              },
              "assignmentSha256": {
                "type": "null"
              },
              "rawArchiveSha256": {
                "type": "null"
              },
              "candidateNdjsonSha256": {
                "type": "null"
              },
              "candidateManifestSha256": {
                "type": "null"
              },
              "selectionCodeSha256": {
                "type": "null"
              },
              "stockfishExecutableSha256": {
                "type": "null"
              },
              "stockfishNetworkSha256s": {
                "type": "null"
              }
            }
          }
        }
      },
      "else": {
        "properties": {
          "source": {
            "properties": {
              "name": {
                "const": "Lichess database"
              },
              "release": {
                "const": "2026-06"
              },
              "url": {
                "const": "https://database.lichess.org/standard/lichess_db_standard_rated_2026-06.pgn.zst"
              },
              "license": {
                "const": "CC0-1.0"
              }
            }
          },
          "openingClusters": {
            "minItems": 1
          },
          "assignments": {
            "minItems": 1
          },
          "freeze": {
            "properties": {
              "immutable": {
                "const": true
              },
              "freezeBaseCommit": {
                "$ref": "#/$defs/gitSha"
              },
              "contentSha256": {
                "$ref": "#/$defs/sha256"
              },
              "openingSetSha256": {
                "$ref": "#/$defs/sha256"
              },
              "assignmentSha256": {
                "$ref": "#/$defs/sha256"
              },
              "rawArchiveSha256": {
                "const": "8fd81071f56511e7546cb77e38db5cf32f7e8a437fb906e26959cc064d8b1f79"
              },
              "candidateNdjsonSha256": {
                "$ref": "#/$defs/sha256"
              },
              "candidateManifestSha256": {
                "$ref": "#/$defs/sha256"
              },
              "selectionCodeSha256": {
                "$ref": "#/$defs/sha256"
              },
              "stockfishExecutableSha256": {
                "$ref": "#/$defs/sha256"
              },
              "stockfishNetworkSha256s": {
                "type": "array",
                "minItems": 2,
                "maxItems": 2,
                "items": {
                  "$ref": "#/$defs/sha256"
                },
                "uniqueItems": true
              }
            }
          }
        }
      }
    }
  ],
  "$defs": {
    "sha256": {
      "type": "string",
      "pattern": "^[0-9a-f]{64}$"
    },
    "gitSha": {
      "type": "string",
      "pattern": "^[0-9a-f]{40}$"
    },
    "filePin": {
      "type": "object",
      "additionalProperties": false,
      "required": [
        "path",
        "sha256"
      ],
      "properties": {
        "path": {
          "type": "string",
          "minLength": 1
        },
        "sha256": {
          "$ref": "#/$defs/sha256"
        }
      }
    },
    "productBaseline": {
      "type": "object",
      "additionalProperties": false,
      "required": [
        "release",
        "gitCommit",
        "wasmAsset",
        "wasmSha256"
      ],
      "properties": {
        "release": {
          "const": "r69"
        },
        "gitCommit": {
          "$ref": "#/$defs/gitSha"
        },
        "wasmAsset": {
          "const": "assets/chessy-ai-fast.wasm"
        },
        "wasmSha256": {
          "$ref": "#/$defs/sha256"
        }
      }
    },
    "source": {
      "type": "object",
      "additionalProperties": false,
      "required": [
        "name",
        "release",
        "url",
        "license",
        "selectionPolicy"
      ],
      "properties": {
        "name": {
          "type": [
            "string",
            "null"
          ]
        },
        "release": {
          "type": [
            "string",
            "null"
          ]
        },
        "url": {
          "type": [
            "string",
            "null"
          ]
        },
        "license": {
          "const": "CC0-1.0"
        },
        "selectionPolicy": {
          "const": "separate-from-certification"
        }
      }
    },
    "anchorRuntime": {
      "type": "object",
      "additionalProperties": false,
      "required": [
        "engine",
        "releaseTag",
        "sourceCommit",
        "archiveName",
        "archiveSha256"
      ],
      "properties": {
        "engine": {
          "const": "Stockfish 18"
        },
        "releaseTag": {
          "const": "sf_18"
        },
        "sourceCommit": {
          "$ref": "#/$defs/gitSha"
        },
        "archiveName": {
          "const": "stockfish-ubuntu-x86-64-avx2.tar"
        },
        "archiveSha256": {
          "$ref": "#/$defs/sha256"
        }
      }
    },
    "explorationSchedule": {
      "type": "object",
      "additionalProperties": false,
      "required": [
        "level",
        "allowedAnchors",
        "openingClusters",
        "games",
        "anchorAllocation"
      ],
      "properties": {
        "level": {
          "enum": [
            "easy",
            "medium",
            "hard",
            "expert",
            "master"
          ]
        },
        "allowedAnchors": {
          "type": "array",
          "minItems": 3,
          "maxItems": 3,
          "items": {
            "type": "integer"
          },
          "uniqueItems": true
        },
        "openingClusters": {
          "type": [
            "integer",
            "null"
          ],
          "minimum": 1
        },
        "games": {
          "type": [
            "integer",
            "null"
          ],
          "minimum": 2
        },
        "anchorAllocation": {
          "type": "array",
          "items": {
            "$ref": "#/$defs/anchorAllocation"
          }
        }
      }
    },
    "anchorAllocation": {
      "type": "object",
      "additionalProperties": false,
      "required": [
        "elo",
        "openingClusters",
        "games"
      ],
      "properties": {
        "elo": {
          "type": "integer"
        },
        "openingClusters": {
          "type": "integer",
          "minimum": 1
        },
        "games": {
          "type": "integer",
          "minimum": 2
        }
      }
    },
    "openingCluster": {
      "type": "object",
      "additionalProperties": false,
      "required": [
        "clusterId",
        "openingId",
        "fen",
        "eco",
        "openingFamily",
        "initialBalanceCp",
        "sourceRecordIds",
        "sourceGameIds",
        "positionFamilyIds",
        "clusterMembers"
      ],
      "properties": {
        "clusterId": {
          "$ref": "#/$defs/sha256"
        },
        "openingId": {
          "type": "string",
          "pattern": "^op-[0-9a-f]{64}$"
        },
        "fen": {
          "type": "string",
          "minLength": 1
        },
        "eco": {
          "type": "string",
          "pattern": "^[A-E][0-9]{2}$"
        },
        "openingFamily": {
          "type": "string",
          "minLength": 1,
          "maxLength": 256,
          "pattern": "^(?!\\s)(?!.*\\s$)(?!.*(?:[Hh][Tt][Tt][Pp][Ss]?://|[Ll][Ii][Cc][Hh][Ee][Ss][Ss]\\.org/))[^\\u0000-\\u001f\\u007f]+$"
        },
        "initialBalanceCp": {
          "type": "integer",
          "minimum": -200,
          "maximum": 200
        },
        "sourceRecordIds": {
          "type": "array",
          "minItems": 1,
          "items": {
            "type": "string",
            "pattern": "^chessy\\.e4\\.lichess-standard-rated\\.2026-06:candidate:[0-9a-f]{64}$"
          },
          "uniqueItems": true
        },
        "sourceGameIds": {
          "type": "array",
          "minItems": 1,
          "items": {
            "type": "string",
            "pattern": "^chessy\\.e4\\.lichess-standard-rated\\.2026-06:game:[0-9a-f]{64}$"
          },
          "uniqueItems": true
        },
        "positionFamilyIds": {
          "type": "array",
          "minItems": 1,
          "items": {
            "$ref": "#/$defs/sha256"
          },
          "uniqueItems": true
        },
        "clusterMembers": {
          "type": "array",
          "minItems": 1,
          "items": {
            "type": "string",
            "minLength": 1
          },
          "uniqueItems": true
        }
      }
    },
    "explorationAssignment": {
      "type": "object",
      "additionalProperties": false,
      "required": [
        "level",
        "anchor",
        "openingClusterId",
        "openingId",
        "colors",
        "games"
      ],
      "properties": {
        "level": {
          "enum": [
            "easy",
            "medium",
            "hard",
            "expert",
            "master"
          ]
        },
        "anchor": {
          "type": "integer"
        },
        "openingClusterId": {
          "type": "string",
          "minLength": 1
        },
        "openingId": {
          "type": "string",
          "minLength": 1
        },
        "colors": {
          "const": [
            "white",
            "black"
          ]
        },
        "games": {
          "const": 2
        }
      }
    },
    "freeze": {
      "type": "object",
      "additionalProperties": false,
      "required": [
        "immutable",
        "freezeBaseCommit",
        "contentSha256",
        "openingSetSha256",
        "assignmentSha256",
        "rawArchiveSha256",
        "candidateNdjsonSha256",
        "candidateManifestSha256",
        "selectionCodeSha256",
        "stockfishExecutableSha256",
        "stockfishNetworkSha256s"
      ],
      "properties": {
        "immutable": {
          "type": "boolean"
        },
        "freezeBaseCommit": {
          "description": "Commit containing the pinned selector/input contracts from which this generated manifest was built; never the self-referential commit that contains this manifest.",
          "type": [
            "string",
            "null"
          ]
        },
        "contentSha256": {
          "type": [
            "string",
            "null"
          ]
        },
        "openingSetSha256": {
          "type": [
            "string",
            "null"
          ]
        },
        "assignmentSha256": {
          "type": [
            "string",
            "null"
          ]
        },
        "rawArchiveSha256": {
          "type": [
            "string",
            "null"
          ]
        },
        "candidateNdjsonSha256": {
          "type": [
            "string",
            "null"
          ]
        },
        "candidateManifestSha256": {
          "type": [
            "string",
            "null"
          ]
        },
        "selectionCodeSha256": {
          "type": [
            "string",
            "null"
          ]
        },
        "stockfishExecutableSha256": {
          "type": [
            "string",
            "null"
          ]
        },
        "stockfishNetworkSha256s": {
          "oneOf": [
            {
              "type": "null"
            },
            {
              "type": "array",
              "minItems": 2,
              "maxItems": 2,
              "items": {
                "$ref": "#/$defs/sha256"
              },
              "uniqueItems": true
            }
          ]
        }
      }
    }
  }
}
